,Rank,Author,Title,Citations,Year,Publisher,Venue,Source,cit/year
111,91,"Zheng, C Wang, N Jia",Emotion recognition model based on multimodal decision fusion,3,2021, iopscience.iop.org, Journal of Physics: Conference Series,https://iopscience.iop.org/article/10.1088/1742-6596/1873/1/012092/meta,1
112,71,"Fang, A He, Q Yu, B Gao, W Ding, T Zhang…","FAF: A novel multimodal emotion recognition approach integrating face, body and text",0,2022, arxiv.org, arXiv preprint arXiv …,https://arxiv.org/abs/2211.15425,0
113,69,"Li, X Lin, Y Liu, R Song, J Cheng…",EEG-Based Emotion Recognition via Efficient Convolutional Neural Network and Contrastive Learning,1,2022, ieeexplore.ieee.org, IEEE Sensors …,https://ieeexplore.ieee.org/abstract/document/9875025/,0
114,74,"Liu, Y Wei, C Li, J Cheng, R Song…",Bi-CapsNet: A Binary Capsule Network for EEG-based Emotion Recognition,0,2022, ieeexplore.ieee.org, IEEE Journal of …,https://ieeexplore.ieee.org/abstract/document/9999486/,0
115,75,"Li, C Ren, C Li, N Zhao, D Lu…",SSTD: A Novel Spatio-Temporal Demographic Network for EEG-Based Emotion Recognition,1,2022, ieeexplore.ieee.org, IEEE Transactions on …,https://ieeexplore.ieee.org/abstract/document/9829548/,0
116,77,"Kim, TS Kim, WH Lee",Accelerating 3D convolutional neural network with channel bottleneck module for EEG-based emotion recognition,1,2022, mdpi.com, Sensors,https://www.mdpi.com/1820502,0
117,79," Montero Quispe, DMS Utyiama, EM Dos Santos…",Applying Self-Supervised Representation Learning for Emotion Recognition Using Physiological Signals,0,2022, mdpi.com, Sensors,https://www.mdpi.com/1424-8220/22/23/9102,0
118,85, Arthanarisamy Ramaswamy…,Subject independent emotion recognition using EEG and physiological signals–a comparative study,0,2022, emerald.com, Applied Computing and …,https://www.emerald.com/insight/content/doi/10.1108/ACI-03-2022-0080/full/html,0
119,86,"Zeng, Q Wu, Y Jin, H Zheng, M Li…",Siam-GCAN: A Siamese Graph Convolutional Attention Network for EEG Emotion Recognition,0,2022, ieeexplore.ieee.org, IEEE Transactions …,https://ieeexplore.ieee.org/abstract/document/9931735/,0
120,88,"Tian, D Li, Y Yang, F Hou, Z Yang…",A Novel Domain Adversarial Networks Based on 3D-LSTM and Local Domain Discriminator for Hearing-Impaired Emotion Recognition,1,2022, ieeexplore.ieee.org, IEEE Journal of …,https://ieeexplore.ieee.org/abstract/document/9913332/,0
121,89,Wang,Emotion Recognition Based on Multi-scale Convolutional Neural Network,0,2023, Springer, Data Mining and Big Data: 7th International …,https://link.springer.com/chapter/10.1007/978-981-19-9297-1_12,0
122,93,"Sun, H Li, L Ma",Speech emotion recognition based on improved masking EMD and convolutional recurrent neural network,0,2022, ncbi.nlm.nih.gov, Frontiers in Psychology,https://www.ncbi.nlm.nih.gov/pmc/articles/PMC9869168/,0
123,96,"Guo, Z Chen, Y Li, H Liu",Audio-Visual Fusion Network Based on Conformer for Multimodal Emotion Recognition,0,2023, Springer, …   CICAI 2022  Beijing  China  August 27–28 …,https://link.springer.com/chapter/10.1007/978-3-031-20500-2_26,0
124,97,"Jia, B Zhang, H Lv, Z Xu, S Hu, H Li",CR-GCN: Channel-Relationships-Based Graph Convolutional Network for EEG Emotion Recognition,1,2022, mdpi.com, Brain Sciences,https://www.mdpi.com/1744406,0
125,14,"Wang, Z Zhou, H Shen, Q Xu, K Huang",JDAT: Joint-Dimension-Aware Transformer with Strong Flexibility for EEG Emotion Recognition,1,2021, techrxiv.org,,https://www.techrxiv.org/articles/preprint/JDAT_Joint-Dimension-Aware_Transformer_with_Strong_Flexibility_for_EEG_Emotion_Recognition/17056961,0
126,33,Marson,EEG data driven automatic soundtrack composition based on emotion recognition,0,2022, politesi.polimi.it,,https://www.politesi.polimi.it/handle/10589/188575,0
127,29,"Qayyum, I Razzak, M Tanveer…",Spontaneous Facial Behavior Analysis using Deep Transformer Based Framework for Child–Computer Interaction,1,2022, dl.acm.org, ACM Transactions on …,https://dl.acm.org/doi/abs/10.1145/3539577,0
128,59,"Zhao, L Pang, Y Lu, F Xie, Z He, X Gong…",Conditional Domain Adaptation Based on Initial Distribution Discrepancy for EEG Emotion Recognition,0,2023, Springer,Based …,https://link.springer.com/chapter/10.1007/978-3-031-23179-7_8,0
129,62,"Ye, CLP Chen, T Zhang",Hierarchical Dynamic Graph Convolutional Network With Interpretability for EEG-Based Emotion Recognition,1,2022, ieeexplore.ieee.org, IEEE Transactions on Neural …,https://ieeexplore.ieee.org/abstract/document/9979692/,0
