,Rank,Author,Title,Citations,Year,Publisher,Venue,Source,cit/year
0,38,"Kostas, S Aroc",BENDR: using transformers and a contrastive self-supervised learning task to learn from massive amounts of EEG data,56,2021, frontiersin.org, Frontiers in Human …,https://www.frontiersin.org/articles/10.3389/fnhum.2021.653659/full,19
1,70," Rajpoot, MR Panicker",Subject independent emotion recognition using EEG signals employing attention driven neural networks,26,2022, Elsevier, Biomedical Signal Processing and Control,https://www.sciencedirect.com/science/article/pii/S1746809422000696,13
2,32,"Song, X Jia, L Yang, L Xie",Transformer-based spatial-temporal feature learning for EEG decoding,35,2021, arxiv.org, arXiv preprint arXiv:2106.11170,https://arxiv.org/abs/2106.11170,12
3,2,"Wang, Y Wang, C Hu, Z Yin, Y Song",Transformers for EEG-based emotion recognition: A hierarchical spatial information learning model,19,2022, ieeexplore.ieee.org, IEEE Sensors Journal,https://ieeexplore.ieee.org/abstract/document/9684393/,10
4,1,"Liu, L Zhang, H Wu, H Zhao",Transformers for EEG emotion recognition,20,2021, arxiv.org, arXiv preprint arXiv:2110.06553,https://arxiv.org/abs/2110.06553,7
5,61,"Jia, Y Lin, J Wang, Z Feng, X Xie…",HetEmotionNet: two-stream heterogeneous graph recurrent neural network for multi-modal emotion recognition,15,2021, dl.acm.org, Proceedings of the 29th …,https://dl.acm.org/doi/abs/10.1145/3474085.3475583,5
6,28," Bird, A Ekárt, DR Faria",Chatbot Interaction with Artificial Intelligence: human data augmentation with T5 and language transformer ensemble for text classification,13,2021, Springer, Journal of Ambient Intelligence and …,https://link.springer.com/article/10.1007/s12652-021-03439-8,4
7,67,Lun,A proposal for multimodal emotion recognition using aural transformers and action units on RAVDESS dataset,13,2021, mdpi.com, Applied Sciences,https://www.mdpi.com/2076-3417/12/1/327,4
8,83,"Pedoeem, G Bar Yosef, S Abittan, S Keene",Tabs: Transformer based seizure detection,9,2022, Springer, Biomedical Sensing and …,https://link.springer.com/chapter/10.1007/978-3-030-99383-2_4,4
9,27,"Tao, T Sun, A Muhamed, S Genc…",Gated transformer for decoding human brain EEG signals,11,2021, ieeexplore.ieee.org, 2021 43rd Annual …,https://ieeexplore.ieee.org/abstract/document/9630210/,4
10,21,"Han, J Qiu, J Zhu, M Xu, D Weber, B Li…",An empirical exploration of cross-domain alignment between language and electroencephalogram,6,2022, arxiv.org, arXiv preprint arXiv …,https://arxiv.org/abs/2208.06348,3
11,55,"Wang, J Zhang, X Zhang, P Chen…",Transformer model for functional near-infrared spectroscopy classification,6,2022, ieeexplore.ieee.org, IEEE Journal of …,https://ieeexplore.ieee.org/abstract/document/9670659/,3
12,82,"An, N Xu, Z Qu",Leveraging spatial-temporal convolutional features for EEG-based emotion recognition,10,2021, Elsevier, Biomedical Signal Processing and Control,https://www.sciencedirect.com/science/article/pii/S1746809421003402,3
13,74,"Lin, S Fu, X Lin, L Wang",Multi-label emotion classification based on adversarial multi-task learning,3,2022, Elsevier, Information Processing & Management,https://www.sciencedirect.com/science/article/pii/S0306457322001984,2
14,54,"Kumar, A Shrimal, MS Akhtar…",Discovering emotion and reasoning its flip in multi-party conversations using masked memory network and transformer,5,2022, Elsevier,Based Systems,https://www.sciencedirect.com/science/article/pii/S0950705121011709,2
15,78,"Zhou, D Huang, C Liu, D Jiang",Objectivity meets subjectivity: A subjective and objective feature fused neural network for emotion recognition,4,2022, Elsevier, Applied Soft Computing,https://www.sciencedirect.com/science/article/pii/S1568494622002642,2
16,94,"Chen, S Peng, R Zeng, Z Hu, L Cao…",-Norm Broad Learning for Negative Emotion Classification in Social Networks,3,2022, ieeexplore.ieee.org, Big Data Mining and …,https://ieeexplore.ieee.org/abstract/document/9793355/,2
17,100,"Singh, R Ranjbarzadeh, K Raj, T Kumar…",Understanding EEG signals for subject-wise Definition of Armoni Activities,2,2023, arxiv.org, arXiv preprint arXiv …,https://arxiv.org/abs/2301.00948,2
18,5,"Li, Z Zhang, X Zhang, G Huang…",EEG-based emotion recognition via transformer neural architecture search,5,2022, ieeexplore.ieee.org, IEEE Transactions on …,https://ieeexplore.ieee.org/abstract/document/9763316/,2
19,9,"Arjun, AS Rajpoot…",Introducing attention mechanism for EEG signals: Emotion recognition with vision transformers,7,2021, ieeexplore.ieee.org, 2021 43rd Annual …,https://ieeexplore.ieee.org/abstract/document/9629837/,2
20,3," Guo, Q Cai, JP An, PY Chen, C Ma, JH Wan…",A Transformer based neural network for emotion recognition and visualizations of crucial EEG channels,3,2022, Elsevier, Physica A: Statistical …,https://www.sciencedirect.com/science/article/pii/S0378437122004642,2
21,60,"Hu, L Chen, Y Luo, J Zhou",EEG-Based Emotion Recognition Using Convolutional Recurrent Neural Network with Multi-Head Self-Attention,2,2022, mdpi.com, Applied Sciences,https://www.mdpi.com/1929850,1
22,64," Chien, HC Chou, CC Lee",Self-assessed Emotion Classification from Acoustic and Physiological Features within Small-group Conversation,2,2021, dl.acm.org, … of the 2021 International Conference on …,https://dl.acm.org/doi/abs/10.1145/3461615.3485411,1
23,65," Patamia, W Jin, KN Acheampong…",Transformer based multimodal speech emotion recognition with improved neural networks,2,2021, ieeexplore.ieee.org, 2021 IEEE 2nd …,https://ieeexplore.ieee.org/abstract/document/9520692/,1
24,66,"Shi, Z Chen, R Zhang",A Transformer-Based Spatial-Temporal Sleep Staging Model Through Raw EEG,2,2021, ieeexplore.ieee.org, … on High Performance Big Data and …,https://ieeexplore.ieee.org/abstract/document/9658439/,1
25,11,"Wang, WB Jiang, R Li, BL Lu",Emotion transformer fusion: Complementary representation properties of eeg and eye movements on recognizing anger and surprise,4,2021, ieeexplore.ieee.org, 2021 IEEE International …,https://ieeexplore.ieee.org/abstract/document/9669556/,1
26,72,"Hu, W Sheng, B Dong, X Li",Tntc: two-stream network with transformer-based complementarity for gait-based emotion recognition,2,2022, ieeexplore.ieee.org,2022 IEEE …,https://ieeexplore.ieee.org/abstract/document/9746047/,1
27,50,"Du, Y Xu, X Wang, L Liu, P Ma",EEG temporal–spatial transformer for person identification,2,2022, nature.com, Scientific Reports,https://www.nature.com/articles/s41598-022-18502-3,1
28,44,Vazque,Transformer-Based Self-Supervised Learning for Emotion Recognition,2,2022, ieeexplore.ieee.org, 2022 26th …,https://ieeexplore.ieee.org/abstract/document/9956027/,1
29,6,"Tubaishat, F A",EmoPercept: EEG-based emotion classification through perceiver,2,2022, Springer, Soft Computing,https://link.springer.com/article/10.1007/s00500-021-06578-4,1
30,63,"Siddhad, A Gupta, DP Dogra, PP Roy",Efficacy of transformer networks for classification of raw EEG data,2,2022, arxiv.org, arXiv preprint arXiv:2202.05170,https://arxiv.org/abs/2202.05170,1
31,23,"Zheng, X Zhao, L Yao",Copula-based transformer in EEG to assess visual discomfort induced by stereoscopic 3D,2,2022, Elsevier, Biomedical Signal Processing and Control,https://www.sciencedirect.com/science/article/pii/S1746809422003251,1
32,89,Orlinski,MEG-driven emotion classification using convolutional and recurrent Neural Networks,0,2020, essay.utwente.nl,,http://essay.utwente.nl/82161/,0
33,88,"Khan, AV Singh, R Agrawal",Enhanced Deep Learning Hybrid Model of CNN Based on Spatial Transformer Network for Facial Expression Recognition,0,2022, World Scientific, International Journal of Pattern …,https://www.worldscientific.com/doi/abs/10.1142/S0218001422520280,0
34,99,"Vairachilai, A Bostani, A Mehbodniya, JL Webber…",Body Sensor 5 G Networks Utilising Deep Learning Architectures for Emotion Detection Based On EEG Signal Processing,0,2022, Elsevier, Optik,https://www.sciencedirect.com/science/article/pii/S0030402622017272,0
35,98,Liu,Personality classification via Weibo based on deep learning model,0,2022, ieeexplore.ieee.org, 2022 IEEE 10th International Conference on …,https://ieeexplore.ieee.org/abstract/document/10006430/,0
36,97,"Yang, J Wu, K Ikeda, G Hattori, M Sugano…",Face-mask-aware Facial Expression Recognition based on Face Parsing and Vision Transformer,1,2022, Elsevier, Pattern Recognition …,https://www.sciencedirect.com/science/article/pii/S0167865522003312,0
37,68,"Chen, Y Zhang, Y Pan, P Xu, C Guan",A Transformer-based deep neural network model for SSVEP classification,1,2022, arxiv.org, arXiv preprint arXiv:2210.04172,https://arxiv.org/abs/2210.04172,0
38,96,"Sharma, M Diwakar, C Arya",A systematic review on emotion recognition by using machine learning approaches,0,2022, aip.scitation.org, AIP Conference Proceedings,https://aip.scitation.org/doi/abs/10.1063/5.0113378,0
39,69,"Ma, C Liu, MS Ma, Y Yang, ND Truong, K Kothur…",TSD: Transformers for Seizure Detection,0,2023, biorxiv.org, bioRxiv,https://www.biorxiv.org/content/10.1101/2023.01.24.525308.abstract,0
40,8,"Sun, W Cui, S Yu, H Han, B Hu…",A Dual-Branch Dynamic Graph Convolution Based Adaptive TransFormer Feature Fusion Network for EEG Emotion Recognition,0,2022, ieeexplore.ieee.org, IEEE Transactions on …,https://ieeexplore.ieee.org/abstract/document/9857970/,0
41,71,"Busia, A Cossettini, TM Ingolfsson…",EEGformer: Transformer-Based Epilepsy Detection on Raw EEG Traces for Low-Channel-Count Wearable Continuous Monitoring Devices,0,2022, ieeexplore.ieee.org, … Circuits and Systems …,https://ieeexplore.ieee.org/abstract/document/9948637/,0
42,95,"Deng, Z Wang, K Liu, X Xiang",A GAN model encoded by CapsEEGNet for visual EEG encoding and image reproduction,0,2023, Elsevier, Journal of Neuroscience Methods,https://www.sciencedirect.com/science/article/pii/S0165027022002734,0
43,93," Viji, J Jasper, T Latha",Efficient Emotion Based Automatic Speech Recognition Using Optimal Deep Learning Approach,0,2022, Elsevier, Optik,https://www.sciencedirect.com/science/article/pii/S0030402622016333,0
44,73,"Yunxiang, Z Kexin",Cross-corpus bimodal speech emotion recognition,0,2022, authorea.com, Authorea Preprints,https://www.authorea.com/doi/full/10.22541/au.167043076.61971339,0
45,7,"Peng, K Zhao, H Zhang, D Xu, X Kong",Temporal relative transformer encoding cooperating with channel attention for EEG emotion analysis,0,2023, Elsevier, Computers in Biology and …,https://www.sciencedirect.com/science/article/pii/S0010482523000021,0
46,75,"Zhang, H Li, J Xie",MI-CAT: A Transformer-Based Domain Adaptation Network for Motor,0,1172, papers.ssrn.com,,https://papers.ssrn.com/sol3/papers.cfm?abstract_id=4331172,0
47,76,Vazque,Using Multimodal Transformers in Affective Computing,1,2021, ieeexplore.ieee.org, 2021 9th International Conference on …,https://ieeexplore.ieee.org/abstract/document/9666396/,0
48,77,"Du, Y Xu, X Wang, L Liu, P Ma",ETST: EEG Transformer for Person Identification,1,2022, researchsquare.com,,https://www.researchsquare.com/article/rs-1545508/latest.pdf,0
49,92,"Zhang, Y Hua, J Gu, Y Chen…",Dynamic hierarchical learning of temporal-spatial-spectral EEG features with transformers for cognitive workload estimation,0,2022, ieeexplore.ieee.org, 2022 41st Chinese …,https://ieeexplore.ieee.org/abstract/document/9902053/,0
50,91,"Wu, C Lian, Z Zeng, B Xu, Y Su",An Aggregated Convolutional Transformer Based on Slices and Channels for Multivariate Time Series Classification,0,2022, ieeexplore.ieee.org, IEEE Transactions on …,https://ieeexplore.ieee.org/abstract/document/9918094/,0
51,79,"Delvigne, H Wannous, JP Vandeborre…",Spatio-Temporal Analysis of Transformer based Architecture for Attention Estimation from EEG,1,2022, ieeexplore.ieee.org, 2022 26th …,https://ieeexplore.ieee.org/abstract/document/9956610/,0
52,80,"Kuang, C Michoski, W Li, R Guo",A Monotonicity Constrained Attention Module for Emotion Classification with Limited EEG Data,0,2022, Springer, … Learning with Limited and Noisy Data …,https://link.springer.com/chapter/10.1007/978-3-031-16760-7_21,0
53,62,"Bai, J Liu, F Hou, Y Chen, M Cheng, Z Mao…",Emotion recognition with residual network driven by spatial-frequency characteristics of EEG recorded from hearing-impaired adults in response to video clips,0,2023, Elsevier, Computers in Biology …,https://www.sciencedirect.com/science/article/pii/S0010482522010526,0
54,90," Chen, SK Wu, CH Hsueh…",A Deep Research on Stress Classification of Table Tennis Athletes Based on Perceived Stress Scale and EEG,0,2022, ieeexplore.ieee.org, 2022 IET International …,https://ieeexplore.ieee.org/abstract/document/9971585/,0
55,4,"Wei, Y Liu, C Li, J Cheng, R Song, X Chen",TC-Net: A Transformer Capsule Network for EEG-based emotion recognition,0,2023, Elsevier, Computers in Biology and …,https://www.sciencedirect.com/science/article/pii/S0010482522011714,0
56,84,"Xu, Y Zhao, R Zhang, T Xu",Research on Stress Reduction Model Based on Transformer,0,2022, itiis.org, KSII Transactions on Internet and Information …,"http://itiis.org/journals/tiis/digital-library/manuscript/file/38214/TIIS%20Vol%2016,%20No%2012-9.pdf",0
57,85,"Sibilano, A Brunetti, D Buongiorno…",An attention-based deep learning approach for the classification of subjective cognitive decline and mild cognitive impairment using resting-state EEG,0,2023, iopscience.iop.org, Journal of Neural …,https://iopscience.iop.org/article/10.1088/1741-2552/acb96e/meta,0
58,86,"S Chien, H Goh, CM Sandino, JY Cheng",MAEEG: Masked Auto-encoder for EEG Representation Learning,0,2022, arxiv.org, arXiv preprint arXiv …,https://arxiv.org/abs/2211.02625,0
59,87,"Wang, P Gong, Y Zhou, X Wen…",Decoding the continuous motion imagery trajectories of upper limb skeleton points for EEG-based brain-computer interface,0,2022, ieeexplore.ieee.org, IEEE Transactions on …,https://ieeexplore.ieee.org/abstract/document/9964307/,0
60,81,"L Lew, D Wang, KK Ang, JH Lim…",EEG-video emotion-based summarization: Learning with EEG auxiliary signals,0,2022, ieeexplore.ieee.org, IEEE Transactions …,https://ieeexplore.ieee.org/abstract/document/9896953/,0
61,19,"Song, Q Zheng, B Liu, X Gao",EEG Conformer: Convolutional Transformer for EEG Decoding and Visualization,0,2022, ieeexplore.ieee.org, IEEE Transactions on Neural …,https://ieeexplore.ieee.org/abstract/document/9991178/,0
62,10,"Xu, Y Du, J Zou, T Zhou, L Xiao, L Liu",AMDET: Attention based Multiple Dimensions EEG Transformer for Emotion Recognition,0,2022, arxiv.org, arXiv preprint arXiv …,https://arxiv.org/abs/2212.12134,0
63,30,"Yang, B Tag, Y Gu, C Wang, T Dingler…",Mobile Emotion Recognition via Multiple Physiological Signals using Convolution-augmented Transformer,1,2022, dl.acm.org, Proceedings of the …,https://dl.acm.org/doi/abs/10.1145/3512527.3531385,0
64,37,"Xu, X Qin, X Dong, X Cui",Emotion recognition of EEG signals based on variational mode decomposition and weighted cascade forest,0,2023, aimspress.com, Mathematical Biosciences and …,https://www.aimspress.com/aimspress-data/mbe/2023/2/PDF/mbe-20-02-120.pdf,0
65,36,"Zheng, P Chang, F Liu, D Wang",Adaptive Neural Decision Tree For Eeg Based Emotion Recognition,0,1057, papers.ssrn.com,,https://papers.ssrn.com/sol3/papers.cfm?abstract_id=4331057,0
66,35,"Kuang, C Michoski",KAM-A Kernel Attention Module for Emotion Classification with EEG Data,0,2022, Springer, Interpretability of Machine Intelligence in Medical …,https://link.springer.com/chapter/10.1007/978-3-031-17976-1_9,0
67,34,"Wang, Y Xu, J Tian, H Li, W Jiao, Y Sun, G Li",Driving fatigue detection with three non-hair-bearing EEG channels and modified transformer model,0,2022, mdpi.com, Entropy,https://www.mdpi.com/1965322,0
68,33," Kim, DK Jeong, JY Kim",Emotional Stress Recognition Using Electroencephalogram Signals Based on a Three-Dimensional Convolutional Gated Self-Attention Deep Neural Network,0,2022, mdpi.com, Applied Sciences,https://www.mdpi.com/2076-3417/12/21/11162,0
69,15,"Du, X Deng, H Qin, Y Shu, F Liu…",MMPosE: Movie-induced multi-label positive emotion classification through EEG signals,0,2022, ieeexplore.ieee.org, IEEE Transactions …,https://ieeexplore.ieee.org/abstract/document/9946368/,0
70,31,"Fan, H Wang, X Zhu, X Cao, C Yi, Y Chen, J Jia, X Lu",FER-PCVT: Facial Expression Recognition with Patch-Convolutional Vision Transformer for Stroke Patients,0,2022, mdpi.com, Brain Sciences,https://www.mdpi.com/1971906,0
71,29," Lee, SH Chen, TC Chang, WK Lee, HT Hsu…",… Learning of a Transformer-Based Deep Learning Classifier Using an Initial Model from Action Observation EEG Data to Online Motor Imagery Classification,0,2023, mdpi.com, Bioengineering,https://www.mdpi.com/article/10.3390/bioengineering10020186,0
72,20,"Koorathota, Z Khan, P Lapborisuth…",Multimodal Neurophysiological Transformer for Emotion Recognition,0,2022, ieeexplore.ieee.org, 2022 44th Annual …,https://ieeexplore.ieee.org/abstract/document/9871421/,0
73,16,"Liu, Y Zhou, D Zhang",TcT: Temporal and channel Transformer for EEG-based Emotion Recognition,0,2022, ieeexplore.ieee.org, 2022 IEEE 35th International …,https://ieeexplore.ieee.org/abstract/document/9867021/,0
74,17,"Liu, H Wu, L Zhang, Y Zhao",Spatial-temporal Transformers for EEG Emotion Recognition,0,2022, dl.acm.org, 2022 The 6th International Conference …,https://dl.acm.org/doi/abs/10.1145/3571560.3571577,0
75,26,"Li, B Hou, X Li, Z Qiu, B Peng, Y Tian",TMLP+ SRDANN: A domain adaptation method for EEG-based emotion recognition,0,2023, Elsevier, Measurement,https://www.sciencedirect.com/science/article/pii/S0263224122015755,0
76,25,"Lin, J Chen, W Ma, W Tang, Y Wang",EEG Emotion Recognition Using Improved Graph Neural Network with Channel Selection,0,2023, Elsevier, Computer Methods and Programs …,https://www.sciencedirect.com/science/article/pii/S0169260723000470,0
77,24,Vazque,Emotion Recognition with Pre-Trained Transformers Using Multimodal Signals,0,2022, ieeexplore.ieee.org, 2022 10th …,https://ieeexplore.ieee.org/abstract/document/9953852/,0
78,22,"Pan, W Zheng",STS-Transformer: A Spatiotemporal Symmetrical Transformer,0,0, papers.ssrn.com,B Pan,https://papers.ssrn.com/sol3/papers.cfm?abstract_id=4142410,0
79,18,"Cheng, Y Zhang, L Liu, W Liu…",Multi-domain Encoding of Spatiotemporal Dynamics in EEG for Emotion Recognition,0,2022, ieeexplore.ieee.org, IEEE Journal of …,https://ieeexplore.ieee.org/abstract/document/9999476/,0
80,14,"Wang, Y Wang, C Hu, Z Yin, Y Song",Temporal-spatial Representation Learning Transformer for EEG-based Emotion Recognition,0,2022, arxiv.org, arXiv preprint arXiv:2211.08880,https://arxiv.org/abs/2211.08880,0
81,39,"Qu, Z Yin, L Yang",A novel mothed for EEG motor imagery classification with graph convolutional network,0,2023, spiedigitallibrary.org, Third International Conference on …,https://www.spiedigitallibrary.org/conference-proceedings-of-spie/12509/125092S/A-novel-mothed-for-EEG-motor-imagery-classification-with-graph/10.1117/12.2655824.short,0
82,40,"Sharma, R Maheshwari…",Machine Learning for Classification of Antithetical Emotional States,0,2022, ieeexplore.ieee.org, 2022 13th International …,https://ieeexplore.ieee.org/abstract/document/9984477/,0
83,41,"Li, Y Wang, WL Zheng, BL Lu",A Multi-view Spectral-Spatial-Temporal Masked Autoencoder for Decoding Emotions with Self-supervised Learning,0,2022, dl.acm.org, Proceedings of the 30th ACM …,https://dl.acm.org/doi/abs/10.1145/3503161.3548243,0
84,59,"Jia, Z Xiao, P Ji",End-to-end fatigue driving EEG signal detection model based on improved temporal-graph convolution network,0,2023, Elsevier, Computers in Biology and Medicine,https://www.sciencedirect.com/science/article/pii/S0010482522011398,0
85,58,"Tang, Y Wang, X Zhang, Z Wang",STILN: A Novel Spatial-Temporal Information Learning Network for EEG-based Emotion Recognition,0,2022, arxiv.org, arXiv preprint arXiv:2211.12103,https://arxiv.org/abs/2211.12103,0
86,57,"Wang, W Jo, D Zhao, W Wang, B Yang…",Husformer: A Multi-Modal Transformer for Multi-Modal Human State Recognition,0,2022, arxiv.org, arXiv preprint arXiv …,https://arxiv.org/abs/2209.15182,0
87,56,"Lu, Y Zhang, X Chu, Y Liu…",Combining multi-scale convolutional neural network and Transformers for EEG-Based RSVP detection,0,2022, ieeexplore.ieee.org, 2022 37th Youth Academic …,https://ieeexplore.ieee.org/abstract/document/10023688/,0
88,12,"Zhong, Y Gu, Y Luo, X Zeng, G Liu",Bi-hemisphere asymmetric attention network: recognizing emotion from EEG signals based on the transformer,0,2022, Springer, Applied Intelligence,https://link.springer.com/article/10.1007/s10489-022-04228-2,0
89,53,"Liu, H Wu, L Zhang",CR-GAT: Consistency Regularization Enhanced Graph Attention Network for Semi-supervised EEG Emotion Recognition,0,2022, ieeexplore.ieee.org, 2022 IEEE International Conference on …,https://ieeexplore.ieee.org/abstract/document/9994941/,0
90,52, Muglikar,Application of Deep Learning Techniques for EEG Signal Classification,0,2021, search.proquest.com,,https://search.proquest.com/openview/bb45859027392fc9d4ba39e631f5bc6b/1?pq-origsite=gscholar&cbl=18750&diss=y,0
91,13,"Sun, X Wang, K Zhao, S Hao, T Wang",Multi-Channel EEG Emotion Recognition Based on Parallel Transformer and 3D-Convolutional Neural Network,1,2022, mdpi.com, Mathematics,https://www.mdpi.com/2227-7390/10/17/3131,0
92,49,"Zheng, X Zhao, L Yao",Copula-Based Transformer in Stereoscopic EEG Data to Assess Visual Discomfort,0,0, papers.ssrn.com,Y Zheng  X Zhao,https://papers.ssrn.com/sol3/papers.cfm?abstract_id=3986909,0
93,48,"Chen, J Tang, L Zhu, W Kong",A multi-stage dynamical fusion network for multimodal emotion recognition,1,2022, Springer, Cognitive Neurodynamics,https://link.springer.com/article/10.1007/s11571-022-09851-w,0
94,47,"Kala, PK Mishra, SP Dubey",A Detailed Analysis & Parametric Comparison Of Eeg Processing Models,0,2022, pnrjournal.com, Journal of Pharmaceutical Negative …,https://pnrjournal.com/index.php/home/article/download/1299/1072,0
95,46,"Li, M Qiu, L Zhu, W Kong",Feature hypergraph representation learning on spatial-temporal correlations for EEG emotion recognition,0,2022, Springer, Cognitive Neurodynamics,https://link.springer.com/article/10.1007/s11571-022-09890-3,0
96,45,"Kumar, E Cambria…",Transformer-Based Bidirectional Encoder Representations for Emotion Detection from Text,0,2021, ieeexplore.ieee.org, 2021 IEEE Symposium …,https://ieeexplore.ieee.org/abstract/document/9660152/,0
97,43," Kim, DK Jeong, JY Kim",Electroencephalogram-based emotional stress recognition according to audiovisual stimulation using spatial frequency convolutional gated transformer,0,2022, jask.or.kr, The Journal of the Acoustical Society of Korea,https://www.jask.or.kr/articles/xml/50BD/,0
98,42,"Wang, Z Wang",CNN with Self-attention in EEG Classification,0,2022, Springer,Late Breaking Papers …,https://link.springer.com/chapter/10.1007/978-3-031-17618-0_36,0
99,51,"Kurczak, K Białas, R Chalupnik…",Using Brain-Computer Interface (BCI) and Artificial Intelligence for EEG Signal Analysis,0,2022, Springer, Recent Challenges in …,https://link.springer.com/chapter/10.1007/978-981-19-8234-7_17,0
100,90,"Siriwardhana, A Reis, R Weerasekera…","Jointly fine-tuning"" bert-like"" self supervised models to improve multimodal speech emotion recognition",76,2020, arxiv.org, arXiv preprint arXiv …,https://arxiv.org/abs/2008.06682,19
101,82,"Maithri, U Raghavendra, A Gudigar…",Automated emotion recognition: Current trends and future perspectives,19,2022, Elsevier, Computer methods and …,https://www.sciencedirect.com/science/article/pii/S0169260722000311,10
102,94,"Cai, J Yuan, R Zheng, L Huang, K Church",Speech Emotion Recognition with Multi-Task Learning.,28,2021, openreview.net, Interspeech,https://openreview.net/pdf?id=K90Yn2bZZ37H,9
103,73,"Zhao, G Jia, J Yang, G Ding…",Emotion recognition from multiple modalities: Fundamentals and methodologies,26,2021, ieeexplore.ieee.org, IEEE Signal Processing …,https://ieeexplore.ieee.org/abstract/document/9591550/,9
104,81,"Shen, X Liu, X Hu, D Zhang…",Contrastive learning of subject-invariant EEG representations for cross-subject emotion recognition,10,2022, ieeexplore.ieee.org, IEEE Transactions on …,https://ieeexplore.ieee.org/abstract/document/9748967/,5
105,64,"Feng, C Cheng, M Zhao, H Deng…",EEG-based emotion recognition using spatial-temporal graph convolutional LSTM with attention mechanism,6,2022, ieeexplore.ieee.org, IEEE Journal of …,https://ieeexplore.ieee.org/abstract/document/9857562/,3
106,67,"Jin, H Chen, Z Li, J Li",EEG-based emotion recognition using graph convolutional network with learnable electrode relations,5,2021, ieeexplore.ieee.org, … of the IEEE Engineering in Medicine …,https://ieeexplore.ieee.org/abstract/document/9630195/,2
107,72,"Zuo, C Zhang, T Hämäläinen, H Gao, Y Fu, F Cong",Cross-Subject Emotion Recognition Using Fused Entropy Features of EEG,3,2022, mdpi.com, Entropy,https://www.mdpi.com/1824938,2
108,80,"Jiang, P Siriaraya, D Choi, N Kuwahara",Emotion Recognition Using Electroencephalography Signals of Older People for Reminiscence Therapy,3,2022, frontiersin.org, Frontiers in Physiology,https://www.frontiersin.org/articles/10.3389/fphys.2021.823013/full?utm_source=dlvr.it&utm_medium=twitter,2
109,99,"Fan, X Xu, B Cai, X Xing",ISNet: Individual standardization network for speech emotion recognition,4,2022, ieeexplore.ieee.org, IEEE/ACM Transactions on Audio …,https://ieeexplore.ieee.org/abstract/document/9767771/,2
110,100,"Li, T Zhang, CLP Chen, K Yi…",Residual GCB-Net: Residual graph convolutional broad network on emotion recognition,5,2022, ieeexplore.ieee.org, IEEE Transactions on …,https://ieeexplore.ieee.org/abstract/document/9698117/,2
